order_key,order_id,owner,email_account,store,item_description,order_date,amount,currency,status,delivery_provider,tracking_numbers,tracking_url,store_order_url,expected_delivery,actual_delivery,last_updated,last_email_subject,last_email_date,notes,delivery_address
massimodutti_30101502670,30101502670,Artem,noreply@massimodutti.com,Massimo Dutti,"100% mercerised cotton T-shirt (BLACK, M, 19.95€), Wool blend crew neck sweater (TERRA-COTTA, L, 39.",2025-12-26,139.8,EUR,shipped,GLS,YVMH7TNK,,,2025-12-30,,2025-12-30T15:31:19.107Z,Your order N. 30101502670 is on its way,2025-12-29T17:06:31.000Z,"Order confirmed, customer will receive tracking email when it leaves warehouse. Delivery costs 4.95€ with discount -4.95€ applied. | Order has left warehouse, tracking link will be sent separately via email. Free delivery (delivery discount applied). | Order has left warehouse with GLS, currently on its way. Free delivery (delivery discount applied).","Buchschlager Allee 27, 63303 Dreieich, Germany"
amazon_30618221781853939,306-1822178-1853939,Artem,no-reply@amazon.de,Amazon,Unknown item from seller Die-Bücherfrau,,,EUR,delivered,,,,https://www.amazon.de/review/review-your-purchases/listing,,2025-12-27,2025-12-30T15:28:48.684Z,Hat deine aktuelle Amazon-Bestellung deine Erwartungen erfüllt? Überprüfe es auf Amazon,2025-12-27T14:55:02.000Z,Review request email from Amazon asking customer to rate their recent purchase from seller Die-Bücherfrau,
arysstore_5850,5850,Artem,info@arysstore.com,ARYS Store,"FGL Tool Box Pants 5.7 × 1, Size L, 129 €",2025-12-28,129,EUR,confirmed,DHL,,,https://arysstore.com/52462223550/orders/3825d3a0c76373c022c5cfb4d2dff444/authenticate?key=shcct_M2RYYVhRd0lKYWZoV3dqcG5MV09TTTNtMUJNTzcrVk4zUG1tQXA4L3IvNWwxNWtLdkhBaFVRTncwb3ZmK0lRakFQTzRBVDlMQmJhY0dnZFVXMFNlSzJpeTdxaml1Z0xVWnB0SVFnR3NlTXBzREFqeWtvS0E0bnY1TWdSUGFCNm8veEZyWGJBWjUyYWpMVkxJNlhBRlNSZGVhZ3hEODZaQk9mdHlDMlcwM1lSbTFjVnBReVYvVmRRMWRtZU5WVTdqREVTKytYcS9wcCtXM1Fib3A2R0Q1TDg4WFJ3YWNGK0RGRXBqRERnUUNlODZmZlpVaC90T0syWTh1QzV5U0NHUjQzb2xXSlAzUXhiSjhxMDlhTE1ENUovRkJZY3BZVjdIOEU5a0RpUWMxWUVrTS94aFBEckZ2c09xeDVjc0l1K1lRbjF1ZWY5N2pDSjl0eHdXU3R3NUVPNkZMcTZ1eFVaanBtbyticktSK0JEMUg4MmpvWEJyVTJmRDRDZnRvMEZ4SE9kdXpoU0JmaFFsb09UanZnM290Mzd0TUdtUFFWZkJ1V010cTR1cEg0amtHcE5TYWRKUXNTVzQxQ3BBTHJ1RW5BdVF4WWlDZEZpUWF6Tk96b0ViTWtRSzJjaXpsa3ZIRTNlNGJTUmw4akNJMjFOSlJWQ25EL1cwVDVkdERYaCtKbU8vY0tEZ3Z1OHRCbWpHQlREeDBkRk0vOEE2dWZHdDByQk8yNFZ3ZC9Jd3B0NldHcTNpUnJvcVloK2RweUIvblJFMDF3RT0tLWZocG53SlpyL2RVNGZQejEtLWtTc3NuSGlvU2JHRGhObkxvSFluVHc9PQ&syclid=372a07c8-bca3-4179-9f5a-45d91f0dd084,,,2025-12-30T15:29:34.401Z,Order #5850 confirmed,2025-12-28T17:19:57.000Z,Order is being prepared for shipping. Will be notified when sent. DHL Parcel delivery method (2 to 4 business days). Taxes included: 21 €.,Berlin
zalando_10103677626050,10103677626050,Artem,info@service-mail.zalando.de,Zalando,"adidas Originals FIREBIRD Tracksuit bottoms - night indigo, Size M, Quantity 1, 64.95€; Jordan CREW ",2025-12-28,301.8,EUR,out_for_delivery,Hermes,"H1024562675499501017, JD000390015819013542",https://www.myhermes.de/en/empfangen/sendungsverfolgung/suchen/sendungsinformation/#H1024562675499501017,https://en.zalando.de/myaccount/order-detail/10103677626050/,2025-12-30,,2025-12-30T15:31:43.367Z,Deine Sendung kommt heute.,2025-12-30T07:43:06.000Z,"Order will arrive in 2 separate packages. First package (Zalando items) expected Tue, 30 Dec 2025 - Wed, 31 Dec 2025. Second package (New Balance item) expected Sat, 3 Jan 2026 - Wed, 7 Jan 2026. Payment method: Invoice with 14 days to try before paying. Will receive separate delivery confirmation emails for each package. 302 Plus points to be added in 30 days. | Payment due within 14 days of receiving email. If order sent in multiple parts, due date calculated after last package is sent. Tracking may take up to 24 hours to be available. | Payment due within 14 days of receiving email. Tracking may take up to 24 hours to be available. | Package from Zalando is on the way, expected delivery on Tuesday | Delivery scheduled between 16:10 and 18:10 hours on Tuesday, December 30th, 2025",Berlin
zalando_10701189699390,10701189699390,Artem,info@service-mail.zalando.ch,Zalando,"Burton BEERACUDA UNISEX - Sonstige Accessoires - multicoloured, Grösse: One Size, Stück: 1, CHF 26.0",2025-12-28,31.9,CHF,shipped,Swiss Post,996011507334979087,https://www.post.ch/swisspost-tracking?formattedParcelCodes=996011507334979087,https://www.zalando.ch/myaccount/order-detail/10701189699390/,2025-12-30,,2025-12-30T15:30:48.226Z,Dein Paket wird in 1-2 Werktagen geliefert,2025-12-29T14:21:22.000Z,"Standard delivery expected Tuesday Dec 30, 2025. Payment by credit/debit card. Shipping cost CHF 5.90. Customer will receive shipping confirmation email when package is dispatched. | Package has left the warehouse and is on its way. Tracking may take up to 24 hours to be available. Delivery expected in 1-2 business days.","Mikita Yalinski, via della Posta 16, 6934 Bioggio"
tshirtshop_35506,35506,Artem,support@theshirtless.com,T-Shirt Shop,"ZWEI PAKET T-SHIRT × 1, Weiß / XL",,,EUR,delivered,DHL Warenpost International,LG277077695DE,https://www.dhl.de/en/privatkunden/pakete-empfangen/verfolgen.html?idc=LG277077695DE&runtime=standalone,https://letzteshemd.de/62634164430/orders/0c6d21cda08d2274e845f6ee86444603/authenticate?key=shcct_bUowZHdpOVNNU25QVkltQWplNzE5QjFEaXRwNkpDa09rNTNMWndyRzd4M0QwdnZGVThucXIveFlwUEw3SlJHVnd4MzNuYVpneE12WUltU1ZDR0pvbDV1dDdEZ2k2VWtiOFJyWTdobWZBZXovUlUxSU5VVkgzY3JsL09jWklxbUhRUXJ6ZDhibSthUXlFRkZoaTdNV1BpMHpCQVh5WklqOG5KdUxxVzJrY09JOUUrWXRvR05JTm1EbGdNWW1DQ1I2NDNMVVVpZ2Jvd0FzRVU2OFNONzhmdERxUWVvOXJqVzJ0MnQxdjlvWCt2dXlSMUJaTGc2cjBZU2xmcjVEcFExMi9nby85aldyWGFUSis0RUpPODlFQ3NPSUdrcnljZEVlZ3V3cDg2Mm9ZbkxDZXRBK2w3SmoyRGxiZGNBZ1JpMUROa0Q5K2oraENYTUhoMmNtOVRxaWQrVXJTM2l3cDNscllMQ3lEcWtrZmNJbnJqR25MaUo3UjZrWElKV0h0U1dwS0lxdkZ4SnMzNkFaTHNPZk13WEo4a2V4TzNXZ0d2Szd6NUxPZ1lCUm84V0NFeitDbFRXclVLZVptV3hxWEZTRTVpcDB6SmhHbU9XK1FpNitCQkRoSnBsT3hzVG1aR1E2RFpMMjhWVmE2UVp6NUJiNksxNy9XN2M1UDdIa2FDTS9pREI2L2dneUxRSEV4UUxkTEJBdEVrbS9OSEUwV0U5enlBZ0xnNzNSQXJEMnphQlVzbmc0ViszWGhEdE5vYlp2emhYWm5nPT0tLXJWeWs5dWE2ejZTRmU5QmMtLWJIY0FQRzhITlZkWnVudnA5TlZTRHc9PQ&syclid=f2b41983-6001-415e-a99c-5a4829889f44,,2025-12-29,2025-12-30T15:30:23.205Z,Eine Lieferung aus der Bestellung #35506 wurde zugestellt,2025-12-29T08:22:46.000Z,"Delivery confirmation for T-shirt order, customer can contact support if package not received",
zalando_track_996011507334979087,,Artem,notifications@post.ch,Zalando,,,,EUR,shipped,Post CH AG,99.60.115073.34979087,,,,,2025-12-30T15:30:38.327Z,Versandbereit: Paket von Zalando,2025-12-29T12:10:09.000Z,Package from Zalando is ready for shipping and will be on its way soon. CO2-compensated delivery.,
mdplewiska_track_12111098592,,Artem,no-reply@gls-pakete.de,MD-Plewiska,No item details provided,,,EUR,in_transit,GLS,12111098592,,,2024-12-30,,2025-12-30T15:31:10.980Z,📦 Dein Paket wird in wenigen Tagen zugestellt,2025-12-29T15:49:30.000Z,"Package will be delivered Tuesday, December 30 between 13:45 and 17:45. Reference number: 33512352232900100030-30101502670. Options available for alternative delivery locations if not at home.","Artem Dede, Buchschlager Allee 27, 63303 Dreieich"
barthcokontraktlogistikgmbhcexfawlgore_track_00340434665233630945,,Artem,noreply@dhl.de,BARTH+CO KONTRAKTLOGISTIK GmbH & C ex. Fa. WLGORE,,,,EUR,in_transit,DHL,00340434665233630945,https://custcomm.dhl.de/go/10/FW8I-698KMCGA-5YI0ZRUS-173CLMS.html?piececode=00340434665233630945,,2025-12-30,,2025-12-30T15:31:27.605Z,Ihre BARTH+CO KONTRAKTLOGISTIK GmbH & C ex. Fa. WLGORE Sendung ist unterwegs,2025-12-29T18:26:59.000Z,"Package is being loaded and processed. Multiple delivery options available including safe place delivery, neighbor delivery, pickup location redirect, delivery date change, and package pickup service.",